{
  "$schema": "https://json-schema.org/draft/2020-12/schema",
  "title": "P0-v1 frozen artifact manifest",
  "type": "object",
  "additionalProperties": false,
  "required": [
    "$schema",
    "schema_version",
    "artifact_type",
    "artifact_id",
    "artifacts",
    "status",
    "authority",
    "merge_basis",
    "confirmed_defect_refs_pending_repilot",
    "open_deferred_defect_refs",
    "rejected_defect_receipt_refs",
    "defect_resolution_claims"
  ],
  "properties": {
    "$schema": {
      "const": "./frozen-artifact-manifest-v1.schema.json"
    },
    "schema_version": {
      "const": "1.0.0"
    },
    "artifact_type": {
      "const": "P0_V1_FROZEN_ARTIFACT_MANIFEST"
    },
    "artifact_id": {
      "const": "INTERP-DIALOGUE-001P0-V1-FREEZE"
    },
    "artifacts": {
      "type": "array",
      "minItems": 20,
      "items": {
        "type": "object",
        "additionalProperties": false,
        "required": [
          "path",
          "role",
          "sha256"
        ],
        "properties": {
          "path": {
            "$ref": "#/$defs/nonEmptyString"
          },
          "role": {
            "$ref": "#/$defs/token"
          },
          "sha256": {
            "$ref": "#/$defs/sha256"
          }
        }
      }
    },
    "status": {
      "const": "FROZEN_UNEXECUTED"
    },
    "authority": {
      "const": "DIGEST_ACCOUNTING_ONLY_NO_CLAIM_SUPPORT"
    },
    "merge_basis": {
      "const": "PR17_MERGE_COMMIT_eb7f7e69afa8a78cdf0e5b5caf2ccad0a7574108"
    },
    "confirmed_defect_refs_pending_repilot": {
      "$ref": "#/$defs/stringArray"
    },
    "open_deferred_defect_refs": {
      "$ref": "#/$defs/stringArray"
    },
    "rejected_defect_receipt_refs": {
      "$ref": "#/$defs/stringArray"
    },
    "defect_resolution_claims": {
      "type": "array",
      "maxItems": 0,
      "items": {
        "type": "string"
      }
    }
  },
  "$defs": {
    "nonEmptyString": {
      "type": "string",
      "minLength": 1
    },
    "token": {
      "type": "string",
      "pattern": "^[A-Za-z0-9][A-Za-z0-9._:-]*$"
    },
    "sha256": {
      "type": "string",
      "pattern": "^[0-9a-f]{64}$"
    },
    "stringArray": {
      "type": "array",
      "items": {
        "type": "string"
      }
    }
  }
}
