{
  "$schema": "./frozen-artifact-manifest-v1.schema.json",
  "schema_version": "1.0.0",
  "artifact_type": "P0_V1_FROZEN_ARTIFACT_MANIFEST",
  "artifact_id": "INTERP-DIALOGUE-001P0-V1-FREEZE",
  "status": "FROZEN_UNEXECUTED",
  "authority": "DIGEST_ACCOUNTING_ONLY_NO_CLAIM_SUPPORT",
  "merge_basis": "PR17_MERGE_COMMIT_eb7f7e69afa8a78cdf0e5b5caf2ccad0a7574108",
  "confirmed_defect_refs_pending_repilot": [
    "DR-001",
    "DR-002",
    "DR-003",
    "DR-004",
    "DR-005",
    "DR-006",
    "DR-007",
    "DR-008",
    "DR-009"
  ],
  "open_deferred_defect_refs": [
    "DR-010",
    "DR-011",
    "DR-012",
    "DR-013"
  ],
  "rejected_defect_receipt_refs": [
    "DR-014"
  ],
  "defect_resolution_claims": [],
  "artifacts": [
    {
      "path": "research/scenarios/interp-dialogue-001/elicitation/instrument-v0.json",
      "role": "IMMUTABLE_P0_P1_OR_SEMANTIC_BASIS",
      "sha256": "52705bc686a69d43360eb0544eda59571c77dc1e29520ec4b156bcd60f413776"
    },
    {
      "path": "research/scenarios/interp-dialogue-001/elicitation/instrument.schema.json",
      "role": "IMMUTABLE_P0_P1_OR_SEMANTIC_BASIS",
      "sha256": "0023386d724864c7890cdac14807782a347edc741ad5613a3687d68363f92c89"
    },
    {
      "path": "research/scenarios/interp-dialogue-001/elicitation/p1-development-pilot-v0-report.md",
      "role": "IMMUTABLE_P0_P1_OR_SEMANTIC_BASIS",
      "sha256": "18e47174ecd22560f04c18a7f28f5086e1955cf02282488a5fcf93dd2af61157"
    },
    {
      "path": "research/scenarios/interp-dialogue-001/elicitation/p1/assessment/analyst-adjudication-v0.json",
      "role": "IMMUTABLE_P0_P1_OR_SEMANTIC_BASIS",
      "sha256": "8a85d0a5702d99258bfcd44df779d34c40bdd830660f3cc03230c3a900192b9b"
    },
    {
      "path": "research/scenarios/interp-dialogue-001/elicitation/p1/proposals/instrument-revision-proposals-v0.json",
      "role": "IMMUTABLE_P0_P1_OR_SEMANTIC_BASIS",
      "sha256": "5c1225d90bb7483102fdb29ffd8da129f11c9f300cdac625d080edc1937248b1"
    },
    {
      "path": "research/scenarios/interp-dialogue-001/elicitation/p1/runs/artifact-manifest-v0.json",
      "role": "IMMUTABLE_P0_P1_OR_SEMANTIC_BASIS",
      "sha256": "2063dfd1d099cbc04b20dcad3409a6f69ad08d6f8cb2e9092c980bf519ceeffe"
    },
    {
      "path": "research/scenarios/interp-dialogue-001/families/rel-boundary.json",
      "role": "IMMUTABLE_P0_P1_OR_SEMANTIC_BASIS",
      "sha256": "4eb342e655ded940ab8537f4e7827692829967a35f17feb375e731a24d2750e2"
    },
    {
      "path": "research/scenarios/interp-dialogue-001/families/risk-footsteps.json",
      "role": "IMMUTABLE_P0_P1_OR_SEMANTIC_BASIS",
      "sha256": "4fbe69cbe8bd8edb631c9012810dbf935b69f10d5afa7c670638177eabb2a256"
    },
    {
      "path": "research/scenarios/interp-dialogue-001/families/work-feedback.json",
      "role": "IMMUTABLE_P0_P1_OR_SEMANTIC_BASIS",
      "sha256": "71cedb46667d1fc2ab76ee1e9711e8f0344e3fea6cf9bd16b577643d292d5823"
    },
    {
      "path": "research/scenarios/interp-dialogue-001/trace-oracle-v1.json",
      "role": "IMMUTABLE_P0_P1_OR_SEMANTIC_BASIS",
      "sha256": "9caefdf39b9ac41c355f8afed0f4c5d0f780499f571346ef2a7042fa30da74b9"
    },
    {
      "path": "research/scenarios/interp-dialogue-001/elicitation/p0-v1/development-assessment-v1.schema.json",
      "role": "P0_V1_SCHEMA",
      "sha256": "8880733a82a659f21d5b82ca2989ce57617ae5e21beb22f285b7692b6e639f09"
    },
    {
      "path": "research/scenarios/interp-dialogue-001/elicitation/p0-v1/frozen-artifact-manifest-v1.schema.json",
      "role": "P0_V1_SCHEMA",
      "sha256": "b701469be49ec79510941df07073f1e774ac2d6bac767dd69deabd9746e67b6b"
    },
    {
      "path": "research/scenarios/interp-dialogue-001/elicitation/p0-v1/instrument-v1.json",
      "role": "P0_V1_FROZEN_ARTIFACT",
      "sha256": "7abfb1c68fbccc47697f4f584e9a7669733ea30529ba39faa2f841241dc83239"
    },
    {
      "path": "research/scenarios/interp-dialogue-001/elicitation/p0-v1/instrument-v1.schema.json",
      "role": "P0_V1_SCHEMA",
      "sha256": "524358056f2ee05c167ab17336f11848eb34cc76bfc58c3cb4b8ea7ff41fd396"
    },
    {
      "path": "research/scenarios/interp-dialogue-001/elicitation/p0-v1/mapping-attempt-v1.schema.json",
      "role": "P0_V1_SCHEMA",
      "sha256": "54b917365e92c59179d4339fb7fcc56d6506f339cb895c090575d06c4d4552c8"
    },
    {
      "path": "research/scenarios/interp-dialogue-001/elicitation/p0-v1/p0-decision-receipts-v1.json",
      "role": "P0_V1_FROZEN_ARTIFACT",
      "sha256": "b0ad767f1611651aa9267de275cc00a08271a24f3290019d6f3a4c07d27c81cc"
    },
    {
      "path": "research/scenarios/interp-dialogue-001/elicitation/p0-v1/p0-decision-receipts-v1.schema.json",
      "role": "P0_V1_SCHEMA",
      "sha256": "014eaad6ae30be810319ed1c8dd763eb51454c6cf8047f753de3daab6196a96b"
    },
    {
      "path": "research/scenarios/interp-dialogue-001/elicitation/p0-v1/participant-surface-v1.json",
      "role": "P0_V1_FROZEN_ARTIFACT",
      "sha256": "4162390948b5d346d4accbdd42286d66bc32c99174a169b3307a1b05b9d5587f"
    },
    {
      "path": "research/scenarios/interp-dialogue-001/elicitation/p0-v1/participant-surface-v1.schema.json",
      "role": "P0_V1_SCHEMA",
      "sha256": "e8c0ac8ab94f65328fcd07770301eff7c7fd76a9817cd49f221eb10258641411"
    },
    {
      "path": "research/scenarios/interp-dialogue-001/elicitation/p0-v1/proposal-disposition-record-v1.json",
      "role": "P0_V1_FROZEN_ARTIFACT",
      "sha256": "eb7004fcbdb958f87f18a6f00a2c31aea5181a9a9284882f40a18e621768450a"
    },
    {
      "path": "research/scenarios/interp-dialogue-001/elicitation/p0-v1/proposal-disposition-record-v1.schema.json",
      "role": "P0_V1_SCHEMA",
      "sha256": "eb28425b0f34e95e26f4dc5db44e977dfff2550cddb120235917d25074076aea"
    },
    {
      "path": "research/scenarios/interp-dialogue-001/elicitation/p0-v1/rendered-surface-catalog-v1.json",
      "role": "P0_V1_FROZEN_ARTIFACT",
      "sha256": "29d336f7c030ceb1a878031a64b0852de56d2b00e42067590c4e05ddf82bc7ba"
    },
    {
      "path": "research/scenarios/interp-dialogue-001/elicitation/p0-v1/rendered-surface-catalog-v1.schema.json",
      "role": "P0_V1_SCHEMA",
      "sha256": "0b3359386d089a8138d16d16431c8434c9d6c73c9f4ce2103018d77d92ce9f0a"
    },
    {
      "path": "research/scenarios/interp-dialogue-001/elicitation/p0-v1/revision-resolution-candidates-v1.json",
      "role": "P0_V1_FROZEN_ARTIFACT",
      "sha256": "8e94d0ae86055df8ec37e57d300720e607c966ec03f32b4c839d2efc6618dc0d"
    },
    {
      "path": "research/scenarios/interp-dialogue-001/elicitation/p0-v1/revision-resolution-candidates-v1.schema.json",
      "role": "P0_V1_SCHEMA",
      "sha256": "369e4b2ef0b76ccaa4b5a85f6abe0233fd3cb61ba40f6aa9d7446d57d3634956"
    }
  ]
}
